{
  "$schema": "./docs/governance/api-stability.schema.json",
  "version": "1.0.0-draft",
  "updatedAt": "2026-08-03",
  "packages": {
    "@kamod-ch/otok-config": {
      "exports": {
        ".": "public"
      },
      "symbols": {
        "PluginContainer": "public",
        "resolveOtokConfig": "public",
        "defineSetup": "public",
        "mergeKits": "experimental",
        "defineKit": "experimental",
        "mergePresets": "experimental"
      }
    },
    "@kamod-ch/otok-vite-plugin": {
      "exports": {
        ".": "public",
        "./client": "public"
      },
      "symbols": {
        "otok": "public"
      }
    },
    "@kamod-ch/otok-test": {
      "exports": {
        ".": "public",
        "./client": "public",
        "./adapter": "public"
      },
      "symbols": {}
    },
    "otok-cli": {
      "exports": {},
      "bin": {
        "otok": "public"
      }
    },
    "@kamod-ch/otok-registry": {
      "exports": {
        ".": "public",
        "./fixtures": "internal"
      },
      "symbols": {}
    },
    "@kamod-ch/otok-route-typegen": {
      "exports": {
        ".": "internal"
      },
      "symbols": {}
    },
    "@kamod-ch/otok-plugin-contract": {
      "exports": {
        ".": "public"
      },
      "symbols": {
        "assertPluginContract": "public"
      }
    },
    "@kamod-ch/otok": {
      "exports": {
        ".": "public",
        "./config": "public",
        "./server": "public",
        "./client": "public",
        "./shared": "public",
        "./route": "public",
        "./rendering": "public",
        "./cache": "public",
        "./client/mutations": "public",
        "./devtools": "experimental"
      },
      "symbols": {
        "defineConfig": "public",
        "definePlugin": "public",
        "defineAdapter": "public",
        "definePreset": "experimental",
        "defineKit": "experimental",
        "createOtokApp": "public",
        "createOtokHandler": "public",
        "createOtokWorkerApp": "public",
        "defineLoader": "public",
        "defineAction": "public",
        "defineMeta": "public",
        "defineRendering": "public",
        "Island": "public",
        "createOtokClient": "public"
      }
    },
    "@kamod-ch/otok-queue": {
      "exports": {
        ".": "public",
        "./providers/memory": "public",
        "./providers/postgres": "public",
        "./worker": "public"
      },
      "symbols": {}
    },
    "@kamod-ch/otok-realtime": {
      "exports": {
        ".": "public",
        "./plugin": "public",
        "./client": "public",
        "./providers/redis": "public",
        "./providers/durable-objects": "public",
        "./cloudflare": "experimental",
        "./testing": "internal",
        "./crm": "experimental"
      },
      "symbols": {}
    },
    "@kamod-ch/otok-workflows": {
      "exports": {
        ".": "public",
        "./plugin": "public",
        "./providers/kysely": "public",
        "./testing": "internal",
        "./crm": "experimental"
      },
      "symbols": {}
    },
    "@kamod-ch/otok-ai": {
      "exports": {
        ".": "public",
        "./loader": "public",
        "./plugin": "public",
        "./providers/test": "internal",
        "./testing": "internal",
        "./cli": "experimental",
        "./tools": "public",
        "./mcp": "public",
        "./rag": "experimental",
        "./budget/kysely": "public"
      },
      "symbols": {
        "AiClient": "public",
        "createMemoryBudgetStore": "public",
        "createKyselyAiBudgetStore": "public",
        "migrateAiBudgetSchema": "public",
        "isAiBudgetReservationStore": "public",
        "beginBilledRound": "public",
        "OtokAiBudgetExceededError": "public"
      }
    },
    "@kamod-ch/otok-discussions": {
      "exports": {
        ".": "experimental",
        "./adapters/memory": "experimental",
        "./kysely": "experimental",
        "./plugin": "experimental",
        "./ui": "experimental",
        "./ui/islands": "experimental",
        "./i18n": "experimental",
        "./notifications": "experimental",
        "./live": "experimental",
        "./testing": "internal"
      },
      "symbols": {}
    }
  },
  "classifications": {
    "public": "SemVer-stable. Breaking changes only in major releases with migration guide.",
    "experimental": "May change in minor releases. Documented opt-in. Not covered by semver guarantees.",
    "internal": "No stability guarantee. Not for external use."
  }
}
